{
  "$schema": "https://json-schema.org/draft/2020-12/schema",
  "$id": "https://nik190799.github.io/cadence/schemas/retro.schema.json",
  "title": "Cadence retrospective entry",
  "description": "Structured JSON form of a single retrospective finding, drafted by the Reviewer subagent and used as the basis for FRAMEWORK_CHANGELOG.md entries.",
  "type": "object",
  "required": [
    "id",
    "ts",
    "what_happened",
    "auto_catchable",
    "rule_existed",
    "proposed_fix",
    "fix_layer"
  ],
  "additionalProperties": false,
  "properties": {
    "id": {
      "type": "string",
      "format": "uuid",
      "description": "Stable identifier for this finding"
    },
    "ts": {
      "type": "string",
      "format": "date-time",
      "description": "When the finding was recorded"
    },
    "feature": {
      "type": "string",
      "description": "Name of the feature run this retrospective covers"
    },
    "what_happened": {
      "type": "string",
      "minLength": 5,
      "description": "One-line description of the observed issue"
    },
    "auto_catchable": {
      "type": "boolean",
      "description": "Whether the issue could be caught mechanically"
    },
    "auto_method": {
      "type": "string",
      "description": "If auto_catchable, what mechanism would catch it (lint, schema, AST check)"
    },
    "rule_existed": {
      "type": "boolean"
    },
    "rule_reference": {
      "type": "string",
      "description": "ADR-NNNN or PATTERNS.md §X if rule_existed was true"
    },
    "proposed_fix": {
      "type": "string",
      "minLength": 5,
      "description": "Concrete action including file paths"
    },
    "fix_layer": {
      "type": "integer",
      "enum": [1, 2, 3, 4],
      "description": "1=Patterns, 2=Process, 3=Automated, 4=Launch"
    },
    "decision": {
      "type": "string",
      "enum": ["approved", "deferred", "rejected"]
    },
    "decision_note": {
      "type": "string",
      "description": "If deferred or rejected, why"
    },
    "landed_in": {
      "type": "string",
      "description": "Commit SHA, PR number, or other reference where the approved fix landed"
    },
    "near_miss": {
      "type": "boolean",
      "default": false,
      "description": "True if this is a gap that turned out fine, false if a real issue caught"
    },
    "tags": {
      "type": "object",
      "description": "Cross-references to standards mappings",
      "additionalProperties": false,
      "properties": {
        "ssdf": {
          "type": "array",
          "items": { "type": "string", "pattern": "^(PO|PS|PW|RV)\\.[0-9]+$" }
        },
        "iso25010": {
          "type": "array",
          "items": {
            "type": "string",
            "enum": [
              "functional-suitability",
              "performance-efficiency",
              "compatibility",
              "interaction-capability",
              "reliability",
              "security",
              "maintainability",
              "flexibility",
              "safety"
            ]
          }
        }
      }
    },
    "violation_sample": {
      "type": "object",
      "description": "Structured form of the offending code. Consumed by tool/emit_rule.py for Layer 3 boundary-class findings: lets the framework auto-generate a fixture + boundary rule and verify the rule actually fires on this exact sample before the finding is recorded as landed.",
      "required": ["kind", "where", "import_line", "forbidden_pattern", "reason"],
      "additionalProperties": false,
      "properties": {
        "kind": {
          "type": "string",
          "enum": ["boundary-rule"],
          "description": "Which auto-emitter handles this sample. Only 'boundary-rule' is wired in v0.3.0-rc.1; future emitters (lint-rule, schema-rule) will add enum values."
        },
        "language": {
          "type": "string",
          "enum": ["ts", "tsx", "js", "py", "go", "rs", "dart", "java", "kt", "swift"],
          "description": "File extension hint for the generated fixture. The checker is language-agnostic, but the fixture file needs the right extension to be scanned."
        },
        "where": {
          "type": "string",
          "minLength": 1,
          "description": "Glob pattern for the file location that must not perform this import (matches cadence.yaml boundaries[].where). Example: 'src/features/**'."
        },
        "import_line": {
          "type": "string",
          "minLength": 1,
          "description": "The exact offending import line as it appeared in the source. The emitter writes this verbatim into the generated fixture."
        },
        "forbidden_pattern": {
          "type": "string",
          "minLength": 1,
          "description": "Glob the import resolves to that the rule must forbid (matches cadence.yaml boundaries[].forbidden[]). Example: 'src/data/sources/**'."
        },
        "reason": {
          "type": "string",
          "minLength": 5,
          "description": "Why this boundary exists. Becomes the cadence.yaml rule's reason field; surfaces in the checker's error output."
        }
      }
    }
  },
  "allOf": [
    {
      "if": {
        "properties": {
          "fix_layer": { "const": 3 },
          "auto_method": { "const": "boundary-rule" }
        },
        "required": ["fix_layer", "auto_method"]
      },
      "then": {
        "required": ["violation_sample"],
        "properties": {
          "violation_sample": {
            "properties": { "kind": { "const": "boundary-rule" } }
          }
        }
      }
    }
  ]
}
